{"schema":"https://schemas.equivalencematrix.dev/v1/release-record","target":"web","app_version":"1.0.0","build_number":"42","source_commit":"aaaaaaaaaaaaaaaaaaaaaaaaaaaaaaaaaaaaaaaa","artifact_digest":"sha256:bbbbbbbbbbbbbbbbbbbbbbbbbbbbbbbbbbbbbbbbbbbbbbbbbbbbbbbbbbbbbbbb","channel":"production","released_at":"2026-08-07T12:00:00Z","producer":"producer://fixture/release","claimed_trust":"untrusted_local","record_digest":"sha256:932ba239c59490c70b5511a1ebd7f823c27e64c10ff524679e00d7d13b92c6c1"}
