{"schema":"https://raw.githubusercontent.com/triesap/eqm/master/schemas/v1/protocol/release-record.schema.json","target":"web","app_version":"1.0.0","build_number":"42","source_commit":"aaaaaaaaaaaaaaaaaaaaaaaaaaaaaaaaaaaaaaaa","artifact_digest":"sha256:bbbbbbbbbbbbbbbbbbbbbbbbbbbbbbbbbbbbbbbbbbbbbbbbbbbbbbbbbbbbbbbb","channel":"production","released_at":"2026-08-07T12:00:00Z","producer":"producer://release/fixture/build-42","claimed_trust":"signed_ci","record_digest":"sha256:419932c2307ecd5e2f75f4860ed9b3f8ecaf9637e2598cb2995be5758eaee571"}
